{
    "$schema": "http://json-schema.org/draft-04/schema#",
    "@odata.id": "Session",
    "additionalProperties": false,
    "copyright": "Copyright 2014-2019 Hewlett Packard Enterprise Development, LP.  Portions Copyright 2014-2019 Distributed Management Task Force. All rights reserved.",
    "description": "The Session resource describes a single connection (session) between a client and a Redfish service instance.",
    "properties": {
        "@odata.context": {
            "$ref": "Resource.json#/definitions/odatacontext"
        },
        "@odata.etag": {
            "$ref": "Resource.json#/definitions/odataetag"
        },
        "@odata.id": {
            "$ref": "Resource.json#/definitions/odataid"
        },
        "@odata.type": {
            "$ref": "Resource.json#/definitions/odatatype"
        },
        "Description": {
            "$ref": "Resource.json#/definitions/Description"
        },
        "Id": {
            "$ref": "Resource.json#/definitions/Id"
        },
        "Name": {
            "$ref": "Resource.json#/definitions/Name"
        },
        "Oem": {
            "additionalProperties": true,
            "properties": {
                "Hpe": {
                    "$ref": "HpeiLOSession.json#"
                }
            },
            "type": "object"
        },
        "UserName": {
            "description": "Name to use to log in to the management processor.",
            "etag": true,
            "readonly": true,
            "type": "string"
        }
    },
    "readonly": true,
    "title": "#Session.v1_0_0.Session",
    "type": "object"
}