{
    "@odata.context": "/redfish/v1/$metadata#CertificateLocations.CertificateLocations",
    "@odata.etag": "W/\"A3A6BF43\"",
    "@odata.id": "/redfish/v1/CertificateService/CertificateLocations",
    "@odata.type": "#CertificateLocations.v1_0_2.CertificateLocations",
    "Id": "CertificateLocations",
    "Description": "Certificate Locations",
    "Name": "Certificate Locations"
}