{
    "@odata.context": "/redfish/v1/$metadata#Session.Session",
    "@odata.etag": "W/\"B4B2DE04\"",
    "@odata.id": "/redfish/v1/SessionService/Sessions/administrator0000000062eaac156dd5bac6",
    "@odata.type": "#Session.v1_0_0.Session",
    "Id": "administrator0000000062eaac156dd5bac6",
    "Description": "Manager User Session",
    "Name": "User Session",
    "Oem": {
        "Hpe": {
            "@odata.context": "/redfish/v1/$metadata#HpeiLOSession.HpeiLOSession",
            "@odata.type": "#HpeiLOSession.v2_1_0.HpeiLOSession",
            "AccessTime": "2022-08-03T17:14:21Z",
            "LoginTime": "2022-08-03T17:10:45Z",
            "MySession": false,
            "UserExpires": "2022-08-03T17:44:21Z",
            "UserIP": "10.117.20.71",
            "UserTag": "Web UI",
            "UserType": "Local"
        }
    },
    "UserName": "Administrator"
}