{
    "@odata.context": "/redfish/v1/$metadata#Session.Session",
    "@odata.etag": "W/\"0258FCFE\"",
    "@odata.id": "/redfish/v1/SessionService/Sessions/engineer0000000062eaa97ac875793d",
    "@odata.type": "#Session.v1_0_0.Session",
    "Id": "engineer0000000062eaa97ac875793d",
    "Description": "Manager User Session",
    "Name": "User Session",
    "Oem": {
        "Hpe": {
            "@odata.context": "/redfish/v1/$metadata#HpeiLOSession.HpeiLOSession",
            "@odata.type": "#HpeiLOSession.v2_1_0.HpeiLOSession",
            "AccessTime": "2022-08-03T17:13:37Z",
            "LoginTime": "2022-08-03T16:59:38Z",
            "MySession": false,
            "UserExpires": "2022-08-03T17:43:37Z",
            "UserIP": "10.105.219.160",
            "UserTag": "REST",
            "UserType": "Local"
        }
    },
    "UserName": "engineer"
}